{
  "schema": 1,
  "record_id": "dddddddd-1111-4111-8111-dddddddddddd",
  "project_root_sha256": "aaaaaaaaaaaaaaaaaaaaaaaaaaaaaaaaaaaaaaaaaaaaaaaaaaaaaaaaaaaaaaaa",
  "epic_id": "22222222-2222-4222-8222-222222222222",
  "epic_ref_key": "e8bf51e33ced6fd2373da93a8317cac9158ff524d31c8d972705b25c6b1873c1",
  "artifact_kind": "brief",
  "publication_operation_id": "11111111-1111-4111-8111-111111111111",
  "prior_publication_receipt_hash": "41705c3ceafab66f05194d91e91e8c169892975ecaa9d4e0fd9c113f232b7fb9",
  "old_anchor_version": 1,
  "new_anchor_version": 2,
  "approved_impact_digest": "4ee29407a66593820b73eecd5eac769c302dce20d0088baa482422401ceed33c",
  "projection_blob_oid": "7777777777777777777777777777777777777777",
  "unchanged_tree_oid": "98f123158205921783838adb57058952a0696d7f",
  "unchanged_pathspec_digest": "4006919827ded05e5cde9e759db130cf8dce7c0b7be1ea29d91016b6f487e788",
  "previous_rebinding_hash": null,
  "receipt_hash": "f24079b79f5329d385634e2424db78b6cb96ffcdba7051f2fb925bd79e3b65c6",
  "created_at_utc": "2026-09-01T00:04:00Z",
  "old_published_commit_oid": "61e1521ed4985292de705c4a48dab789a5a52180",
  "old_published_tree_oid": "4b825dc642cb6eb9a060e54bf8d69288fbee4904",
  "current_planning_head_oid": "c9d8335b60f56d9b7231dcf0aa86cb692827fe72",
  "expected_prior_head_oid": "61e1521ed4985292de705c4a48dab789a5a52180",
  "approved_impact": {
    "decision_id": "anchor-impact-0001",
    "impact": "unaffected",
    "unaffected_reason": "The approved anchor change affects only tech_plan; brief projection bytes and pathspec are unchanged."
  },
  "projection_blob_mode": "100644",
  "projection_bytes_base64": "cHVibGlzaGVkIGJyaWVmIHByb2plY3Rpb24K",
  "projection_blob_sha256": "51061a3a2daa36c48c7e4d76693c3f4c8bc5faf11bdc70e032a69d8dac3dd1d0"
}
